{
  "$schema": "https://json-schema.org/draft/2020-12/schema",
  "$id": "https://omiicare.qa/schemas/api-response-envelope.schema.json",
  "title": "ApiResponse",
  "description": "Standard success envelope returned by every omiiCARE REST endpoint. Matches com.omiicare.qa.shared.api.ApiResponse. Errors use RFC 7807 ProblemDetail instead and are NOT validated by this schema.",
  "type": "object",
  "additionalProperties": false,
  "required": ["success", "data", "correlationId", "timestamp"],
  "properties": {
    "success": {
      "type": "boolean",
      "const": true,
      "description": "Always true for this envelope; failures use ProblemDetail."
    },
    "data": {
      "description": "The payload. Type depends on the endpoint (object, array, or scalar). May be null for 204-style success.",
      "type": ["object", "array", "string", "number", "boolean", "null"]
    },
    "correlationId": {
      "type": ["string", "null"],
      "description": "Request correlation id propagated from MDC; ties the response to audit and log entries.",
      "maxLength": 64
    },
    "timestamp": {
      "type": "string",
      "format": "date-time",
      "description": "ISO-8601 instant (UTC) when the response was produced."
    }
  }
}
