{
  "success": true,
  "data": {
    "id": 4,
    "mrn": "MRN-0004",
    "firstName": "Maria",
    "lastName": "Sample",
    "dateOfBirth": "1992-03-18",
    "gender": "FEMALE",
    "email": "maria.sample@demo.example",
    "phone": "+1-555-0142",
    "status": "ACTIVE"
  },
  "correlationId": "b1f8c0a2-4d6e-4a1b-9c3d-7e2f5a8b1c40",
  "timestamp": "2026-06-30T14:05:12.482Z"
}
